{
  "isOpen": false,
  "canSwichProjection": true,
  "coreBasemaps": [
    {
      "id": "transport",
      "shaded": true,
      "labeled": true
    }
  ],
  "customBasemaps": [
    {
      "id": "streetMap",
      "name": {
        "en": "Street Map",
        "fr": "Street Map"
      },
      "description": {
        "en": "This worldwide street basemap presents highway-level data. From ESRI.",
        "fr": "This worldwide street basemap presents highway-level data. From ESRI."
      },
      "thumbnailUrl": {
        "en": "",
        "fr": ""
      },
      "layers": [
        {
          "id": "World_Street_Map",
          "url": {
            "en": "https://services.arcgisonline.com/arcgis/rest/services/World_Street_Map/MapServer/tile/{z}/{y}/{x}",
            "fr": "https://services.arcgisonline.com/arcgis/rest/services/World_Street_Map/MapServer/tile/{z}/{y}/{x}"
          },
          "opacity": 1,
          "basemapPaneName": "world-street-map",
          "options": {
            "tms": false,
            "tileSize": 1,
            "noWrap": false,
            "attribution": false
          }
        }
      ],
      "attribution": {
        "en": "test attribution",
        "fr": "test attribution"
      },
      "zoomLevels": {
        "min": 0,
        "max": 0
      }
    }
  ],
  "languages": ["en-CA", "fr-CA"]
}
